Method      | Z0.Perm.Init``1(System.ReadOnlySpan{``0})                             | Creates a permutation from the elements in a readonly span
Method      | Z0.Perm.Init``1(``0,System.ValueTuple{``0,``0}[])                     | Initializes permutation with the identity followed by a sequence of transpostions
Method      | Z0.Perm.Init``1(``0,Z0.Swap{``0}[])                                   | Initializes permutation with the identity followed by a sequence of transpostions
Method      | Z0.Perm.Init``1(System.Span{``0})                                     | Creates a permutation from the elements in a span
Method      | Z0.Perm.Init``1(``0[])                                                | Creates a permutation from the elements in a parameter array
Method      | Z0.Perm.Identity``1(``0)                                              | Defines an identity permutation on n symbols
Method      | Z0.Perm.op_Multiply(Z0.Perm,Z0.Perm)                                  | Computes the composition h of f and g where f and g have common length n and            h(i) = g(f(i)) for i = 0, ... n-1
Property    | Z0.Perm.Item(System.Int32)                                            | Term accessor where the term index is in the inclusive range [0, N-1]
Method      | Z0.Perm.Swap(System.ValueTuple{System.Int32,System.Int32}[])          | Effects a sequence of in-place transpositions
Method      | Z0.Perm.Apply(Z0.Swap[])                                              | Effects a sequence of in-place transpositions
Property    | Z0.Perm.Length                                                        | The length of the permutation
Method      | Z0.Perm.Replicate                                                     | Clones the permutation
Method      | Z0.Perm.Compose(Z0.Perm)                                              | Creates a new permutation p via composition, p[i] = g(f(i)) for i = 0, ... n            where f denotes the current permutation
Method      | Z0.Perm.Reverse                                                       | Reverses the permutation in-place
Method      | Z0.Perm.Invert                                                        | Computes the inverse permutation t of the current permutation p             such that p*t = t*p = I where I denotes the identity permutation
Method      | Z0.Perm.Inc                                                           | Applies a modular increment to the permutation in-place
Method      | Z0.Perm.Dec                                                           | Applies a modular decrement to the permutation in-place
Method      | Z0.Perm.Convert``1                                                    | Converts the permutation to a generic permutation over the specified target type
Method      | Z0.Perm.Cycle(System.Int32)                                           | Computes a permutation cycle originating at a specified point
Method      | Z0.Perm.Format(System.Nullable{System.Int32})                         | Formats a permutation as a 2-column matrix
Type        | Z0.PermCycle                                                          | Describes cycle in a perutation
Field       | Z0.PermCycle.Terms                                                    | The terms that define the cycle
Type        | Z0.PermCycle`1                                                        | Describes cycle in a perutation
Field       | Z0.PermCycle`1.Terms                                                  | The terms that define the cycle
Type        | Z0.Perm`1                                                             | Defines a permutation over an integral type based at 0, [0, 1, ..., n - 1] where n is the permutation length
Field       | Z0.Perm`1.terms                                                       | Defines the permutation (0 -&gt; terms[0], 1 -&gt; terms[1], ..., n - 1 -&gt; terms[n-1]) where n is the length of the array
Method      | Z0.Perm`1.From(System.ReadOnlySpan{`0})                               | Defines an untyped permutation determined by values in a source span
Method      | Z0.Perm`1.op_Implicit(`0)~Z0.Perm{`0}                                 | Implicitly converts an integral value n into an identity permutation of length n
Method      | Z0.Perm`1.op_Multiply(Z0.Perm{`0}@,Z0.Perm{`0}@)                      | Computes the composition h of f and g where f and g have common length n and h(i) = g(f(i)) for i = 0, ... n-1
Method      | Z0.Perm`1.#ctor(`0,System.ValueTuple{`0,`0}[])                        | Initializes permutation with the identity followed by a sequence of transpostions
Method      | Z0.Perm`1.#ctor(`0,Z0.Swap{`0}[])                                     | Initializes permutation with the identity followed by a sequence of transpostions
Property    | Z0.Perm`1.Item(System.Int32)                                          | Term accessor where the term index is in the inclusive range [0, N-1]
Property    | Z0.Perm`1.Item(`0)                                                    | Term accessor where the term index is in the inclusive range [0, N-1]
Method      | Z0.Perm`1.Swap(System.ValueTuple{`0,`0}[])                            | Effects a sequence of in-place transpositions
Method      | Z0.Perm`1.Swap(System.ValueTuple{System.Int32,System.Int32}[])        | Effects a sequence of in-place transpositions
Method      | Z0.Perm`1.Swap(Z0.Swap[])                                             | Effects a sequence of in-place transpositions
Method      | Z0.Perm`1.Swap(Z0.Swap{`0}[])                                         | Effects a sequence of in-place transpositions
Property    | Z0.Perm`1.Length                                                      | The length of the permutation
Method      | Z0.Perm`1.Inc                                                         | Applies a modular increment to the permutation in-place
Method      | Z0.Perm`1.Dec                                                         | Applies a modular decrement to the permutation in-place
Method      | Z0.Perm`1.Replicate                                                   | Clones the permutation
Method      | Z0.Perm`1.Compose(Z0.Perm{`0}@)                                       | Creates a new permutation p via composition, p[i] = g(f(i)) for i = 0, ... n where f denotes the current permutation
Method      | Z0.Perm`1.Reverse                                                     | Reverses the permutation in-place
Method      | Z0.Perm`1.Invert                                                      | Computes the inverse permutation t of the current permutation p such that p*t = t*p = I where I denotes the identity permutation
Method      | Z0.Perm`1.Cycle(`0)                                                   | Computes a permutation cycle originating at a specified point
Type        | Z0.PermTerm                                                           | Describes an indivual term of a permutation p, i.e. the point             of evaluation i and its image p(i)
Field       | Z0.PermTerm.Source                                                    | The point at which the permuation is evaluated
Field       | Z0.PermTerm.Target                                                    | The result of evaluating the permuation over the source
Type        | Z0.PermTerm`1                                                         | Describes an indivual term of a permutation p: the point of evaluation i and its image p(i)
Field       | Z0.PermTerm`1.Source                                                  | The point at which the permuation is evaluated
Field       | Z0.PermTerm`1.Target                                                  | The result of evaluating the permuation over the source
Type        | Z0.Swap                                                               | Defines a transposition, i.e. a specification for a two-element position exchange            Typically denoted by an ordered pair of space-delimited indices (i j)
Property    | Z0.Swap.Zero                                                          | The monodial zero
Property    | Z0.Swap.Empty                                                         | The empty element, which is not Zero
Field       | Z0.Swap.i                                                             | The first index
Field       | Z0.Swap.j                                                             | The second index
Method      | Z0.Swap.apply``1(System.Span{``0},Z0.Swap[])                          | Applies a sequence of transpositions to source span elements
Method      | Z0.Swap.inc(Z0.Swap@)                                                 | Effects (i j) -&gt; ((i + 1) (j+ 1))
Method      | Z0.Swap.dec(Z0.Swap@)                                                 | Effects (i j) -&gt; ((i - 1) (j - 1)) where decremented indices are clamped to 0
Method      | Z0.Swap.Chain(Z0.Swap,System.Int32)                                   | Creates a sequence of transpositions
Method      | Z0.Swap.Parse(System.String)                                          | Parses a transposition in canonical form (i j), if possible; otherwise            returns the empty transposition
Method      | Z0.Swap.Format                                                        | Renders the tranposition as text in canonical form
Method      | Z0.Swap.Equals(Z0.Swap)                                               | Determines whether this transposition is identical to another.            Note that the order of indices is immaterial
Method      | Z0.Swap.Replicate                                                     | Creates a copy
Type        | Z0.Swap`1                                                             | Defines a transposition, i.e. a specification for the transposition            of two elements, denoted by an ordered pair of space-delimited indices (i j)
Field       | Z0.Swap`1.i                                                           | The first index
Field       | Z0.Swap`1.j                                                           | The second index
Property    | Z0.Swap`1.Zero                                                        | The monodial zero
Method      | Z0.Swap`1.Chain(Z0.Swap{`0},System.Int32)                             | Creates a chain of transpositions, that includes the initial transposition
Method      | Z0.Swap`1.Format                                                      | Renders the tranposition as text in canonical form
Method      | Z0.Swap`1.Equals(Z0.Swap{`0})                                         | Determines whether this transposition is identical to another.            Note that the order of indices is immaterial
Method      | Z0.Swap`1.Replicate                                                   | Creates a copy
Type        | Z0.Monomial`1                                                         | Represents a one-term polynomial or component of a polynomial with more than one term
Field       | Z0.Monomial`1.Scalar                                                  | The monomial coefficient
Field       | Z0.Monomial`1.Exp                                                     | The monomial exponent/order
Method      | Z0.Monomial`1.Zero(System.UInt32)                                     | Produces the zero monomial of a given order
Property    | Z0.Monomial`1.Nonzero                                                 | Specifies whether the coeifficient, and thus the monomial, is nonzero
Method      | Z0.Monomial`1.Eval(`0)                                                | Evaluates the monomial at a specified point
Type        | Z0.Monomial`2                                                         | Represents a one-term polynomial or component of a polynomial with more than one term            where the scalar coefficient has modulus M
Field       | Z0.Monomial`2.Scalar                                                  | The monomial coefficient
Field       | Z0.Monomial`2.Exp                                                     | The monomial exponent/order
Property    | Z0.Monomial`2.Nonzero                                                 | Specifies whether the coeifficient, and thus the monomial, is nonzero
Type        | Z0.Polynomial`1                                                       | Represents a polynomial
Field       | Z0.Polynomial`1.Zero                                                  | The canonical zero polynomial - with one term of order 0 with coefficient 0
Method      | Z0.Polynomial`1.Define(System.ValueTuple{`0,System.UInt32}[])         | Constructs a polynomial from a sparse term sequence of scalar coefficients  paired with the            corresponding term exponent value
Method      | Z0.Polynomial`1.#ctor(Z0.Monomial{`0}[])                              | Initializes a polynomial from a dense sequence of monomials
Property    | Z0.Polynomial`1.Degree                                                | Specifies the degree of the polynomial as determined by the value of            the exponent of greatest order
Property    | Z0.Polynomial`1.Terms                                                 | The dense sequence of terms that define the polynomial
Property    | Z0.Polynomial`1.Item(System.UInt32)                                   | Selects the term with the specified order if it exists; otherwise, returns the zero monomial
Property    | Z0.Polynomial`1.Item(System.Int32)                                    | Selects the term with the specified order if it exists; otherwise, returns the zero monomial
Property    | Z0.Polynomial`1.Nonzero                                               | Specifies whether some term has a nonzero coeficient value
Method      | Z0.Polynomial`1.Term(System.UInt32)                                   | Selects the term with the specified order if it exists;            otherwise, returns the zero monomial
Method      | Z0.Polynomial`1.Eval(`0)                                              | Evaluates the polynomial at a specified point
Method      | Z0.Polynomial`1.Format(System.Nullable{System.Char})                  | Formats the polynomial in canonical form
Type        | Z0.Polynomial`3                                                       | Represents a base-M polynomial of degree N over values of primal type T
Field       | Z0.Polynomial`3.Zero                                                  | The zero polynomial of degree N
Property    | Z0.Polynomial`3.Item(System.UInt32)                                   | Selects the term with the specified order if it exists;            otherwise, returns the zero monomial
Method      | Z0.Polynomial`3.Term(System.UInt32)                                   | Selects the term with the specified order if it exists;            otherwise, returns the zero monomial
Type        | Z0.NumericSeq`1                                                       | Defines a data structure for sparse/partial sequence representation
Property    | Z0.NumericSeq`1.Terms                                                 | The sequence terms
Property    | Z0.NumericSeq`1.Length                                                | The number of terms in the sequence
Property    | Z0.NumericSeq`1.Item(System.Int32)                                    | Returns a reference to an index-identified term
Property    | Z0.NumericSeq`1.First                                                 | Returns a reference to the first term of the seqence
Type        | Z0.NumericSeqTerm`1                                                   | Defines a sequence term
Field       | Z0.NumericSeqTerm`1.Index                                             | The integer that maps to the term value
Field       | Z0.NumericSeqTerm`1.Value                                             | The term's value
Property    | Z0.NumericSeqTerm`1.IsEmpty                                           | Specifies whether the term is empty
Method      | Z0.NumericSeqTerm`1.Format(System.Nullable{System.Char})              | Renders the term by default as 'a_i = Value' where i denotes the term index
Type        | Z0.gfp                                                                | Defines generic floating-point operations
Method      | Z0.gfp.abs``1(``0)                                                    | Computes the absolute value of a primal FP scalar
Method      | Z0.gfp.dec``1(``0)                                                    | Decrements the source value
Method      | Z0.gfp.div``1(``0,``0)                                                | Computes the quotient of floating-point operands
Method      | Z0.gfp.divmod``1(``0,``0)                                             | Computes dst = (div(a,b), mod(a,b)) for floating-point numeric types
Method      | Z0.gfp.fma``1(``0,``0,``0)                                            | Computes and returns the result r = x*y + z
Method      | Z0.gfp.inc``1(``0)                                                    | Increments the source value
Method      | Z0.gfp.mod``1(``0,``0)                                                | Computes the modulus of floating-point operands
Method      | Z0.gfp.exp``1(``0)                                                    | Raises e to a specified exponent
Method      | Z0.Algorithms.steps``1(``0,``0,System.Int32,``0@)                     | Populates a memory target with values first, first + 1*step, first + 2*step ... first + (n - 1)*step
Method      | Z0.Algorithms.contains``1(Z0.Interval{``0},``0)                       | Determines whether an interval contains a specified point
Method      | Z0.Algorithms.contains``1(``0@,``0,System.Int32)                      | Adapted from corefx repo
Method      | Z0.Algorithms.sequence``1(``0,``0)                                    | Creates an enumerable sequence that ranges between inclusive upper and lower bounds
Method      | Z0.Algorithms.counted``1(``0)                                         | Defines a scalar sequence {0,1,...,count-1}
Method      | Z0.Algorithms.range``1(``0,``0)                                       | Creates a numeric sequence that ranges between inclusive upper and lower bounds
Method      | Z0.Algorithms.range``1(``0,``0,``0)                                   | Creates a numeric sequence that ranges between inclusive upper and lower bounds
Method      | Z0.Algorithms.identical``1(System.Span{``0},System.Span{``0})         | Returns 1 if the left and right spans contain identical content and 0 otherwise
Method      | Z0.Algorithms.identical``1(System.ReadOnlySpan{``0},System.ReadOnlySpan{``0})| Returns 1 if the left and right spans contain identical content and 0 otherwise
Method      | Z0.Algorithms.identical``1(``0@,``0@,System.Int32)                    | Adapted from corefx repo
Type        | Z0.Collector                                                          | A basic statistical accumulator that accrues information over an arbitrary number of input sequences
Method      | Z0.Collector.Create``1(``0)                                           | Creates a collector seeded with the first value
Property    | Z0.Collector.Count                                                    | The number of accumulated observations
Property    | Z0.Collector.Mean                                                     | The accumulated mean
Property    | Z0.Collector.Variance                                                 | The accumulated variance
Property    | Z0.Collector.Stdev                                                    | The accumulated standard deviation
Property    | Z0.Collector.Min                                                      | The accumulated minimum
Property    | Z0.Collector.Max                                                      | The accumulated maximum
Method      | Z0.Collector.Collect``1(``0)                                          | Accumulates a single value
Method      | Z0.Collector.Collect``1(System.Collections.Generic.IEnumerable{``0})  | Accumulates a stream of values
Method      | Z0.Collector.CollectItems``1(``0[])                                   | Accumulates a span of values
Method      | Z0.Collector.Collect``1(System.ReadOnlySpan{``0})                     | Accumulates a span of values
Method      | Z0.Collector.Collect``1(System.Span{``0})                             | Accumulates a span of values
Method      | Z0.genum.sll``3(``0,System.Byte,``1,``2)                              | Converts a source enume value src:E to a parametrically-identified numeric type S,            shifts the converted value to the left a specified number of bits then converts            the outcome of this computation to a numeric type T
Method      | Z0.genum.sll``4(``0,``1,``2,``3)                                      | Converts a source enume value src:E to a parametrically-identified numeric type S,            shifts the converted value to the left a specified number of bits then converts            the outcome of this computation to a numeric type T
Type        | Z0.IAs`2                                                              | Characterizes a value presentation service that overlays a value viewed through the lens of one type            as a value viewed through the lens of another.
Method      | Z0.IAs`2.As(`0)                                                       | Presents src:S as dst:T
Type        | Z0.IAsNumeric`2                                                       | Characterizes a numeric value presentation service
Type        | Z0.IAsNumeric`3                                                       | Characterizes a numeric value presentation service F-bound polymorphic reification
