Method      | Z0.ICheckClose.close``1(System.Span{``0},System.Span{``0},``0,System.String,System.String,System.Nullable{System.Int32})| Asserts that corresponding elements of two source spans of the same length are "close" as determined by a specified tolerance
Method      | Z0.ICheckVectors.veq``1(System.Runtime.Intrinsics.Vector128{``0},System.Runtime.Intrinsics.Vector128{``0},System.String,System.String,System.Nullable{System.Int32})| Asserts the equality of two vectors
Method      | Z0.ICheckVectors.veq``1(System.Runtime.Intrinsics.Vector256{``0},System.Runtime.Intrinsics.Vector256{``0},System.String,System.String,System.Nullable{System.Int32})| Asserts the equality of two vectors
Type        | Z0.enum`2                                                             | Defines a model of an enum literal that is parametric in both the declaring enum            and the underlying primal type it refines
Method      | Z0.gmath.abs``1(``0)                                                  | Computes the absolute value of a primal operand
Method      | Z0.gmath.add``1(``0,``0)                                              | Adds two primal values
Method      | Z0.gmath.avgz``1(``0,``0)                                             | Computes the average of unsigned integral operands, rounding toward zero
Method      | Z0.gmath.avgi``1(``0,``0)                                             | Computes the average of unsigned integral operands, rounding toward infinity
Method      | Z0.gmath.clamp``1(``0,``0)                                            | Clamps the source value to an inclusive maximum
Method      | Z0.gmath.dist``1(``0,``0)                                             | Computes the nonnegative distance between two values
Method      | Z0.gmath.div``1(``0,``0)                                              | Divides the first value by the second
Method      | Z0.gmath.divmod``1(``0,``0)                                           | Computes dst = (div(a,b), mod(a,b))
Method      | Z0.gmath.dot``1(System.ReadOnlySpan{``0},System.ReadOnlySpan{``0})    | Imagines the source operands are vectors of identical length and computes their canonical scalar product
Method      | Z0.gmath.fma``1(``0,``0,``0)                                          | Computes r := x*y + z for primal values x, y, and z
Method      | Z0.gmath.mod``1(``0,``0)                                              | Computes b := a % m
Method      | Z0.gmath.modmul``1(``0,``0,``0)                                       | Computes z := (a*b) mod m
Method      | Z0.gmath.mul``1(``0,``0)                                              | Multiplies two primal values
Method      | Z0.gmath.negate``1(``0)                                               | If the source value is signed, negates it; otherwise, computes            the two's complement negation
Method      | Z0.gmath.odd``1(``0)                                                  | Returns true if a primal integer is odd; false otherwise
Method      | Z0.gmath.even``1(``0)                                                 | Returns true if a primal integer is even; false otherwise
Method      | Z0.gmath.pow2``1(System.Byte)                                         | Computes 2^i where i is an integer value in the interval [0,63]            and 2^i does not exceed the maximum value of T
Method      | Z0.gmath.signum``1(``0)                                               | Computes the sign of a primal operand
Method      | Z0.gmath.sub``1(``0,``0)                                              | Subtracts the right value from the left
Method      | Z0.gmath.cimpl``1(``0,``0)                                            | Computes the converse implication c := ~a | b integral values a and b
Method      | Z0.gmath.impl``1(``0,``0)                                             | Computes the material implication c := a | ~b for integral values a and b
Method      | Z0.gmath.nor``1(``0,``0)                                              | Computes the bitwise nor c := ~(a | b) for integral values a and b
Method      | Z0.gmath.or``1(``0,``0)                                               | Computes the bitwise or between two primal values
Method      | Z0.gmath.or``1(``0,``0,``0)                                           | Computes the bitwise or among three primal values
Method      | Z0.gmath.or``1(``0,``0,``0,``0)                                       | Computes the bitwise or among four primal values
Method      | Z0.gmath.or``1(``0,``0,``0,``0,``0)                                   | Computes the bitwise or among five primal values
Method      | Z0.gmath.blend``1(``0,``0,``0)                                        | This operator is equivalent to select, but is implemented xor(b, and(xor(b,a),  mask))
Method      | Z0.gmath.xor``1(``0,``0)                                              | Computes the XOR of two primal values
Method      | Z0.gmath.xornot``1(``0,``0)                                           | Computes xor(a,not(b))
Method      | Z0.gmath.sal``1(``0,System.Byte)                                      | Applies an arithmetic left-shift to an integer
Method      | Z0.gmath.sra``1(``0,System.Byte)                                      | Applies an arithmetic left-shift to an integer
Method      | Z0.gmath.sll``1(``0,System.Byte)                                      | Applies a logical left-shift to an integral value
Method      | Z0.gmath.srl``1(``0,System.Byte)                                      | Applies a logical right-shift to an integral value
Method      | Z0.gmath.xorsl``1(``0,System.Byte)                                    | Computes a^(a &gt;&gt; offset)
Method      | Z0.gmath.xorsr``1(``0,System.Byte)                                    | Computes a^(a &gt;&gt; offset)
Method      | Z0.gmath.eqz``1(``0,``0)                                              | Defines the operator eqz:T = eq(a,b) ? ones[T] : zero[T]
Method      | Z0.gmath.ltz``1(``0,``0)                                              | Defines the operator ltz:T = lt(a,b) ? ones[T] : zero[T]
Method      | Z0.gmath.gtz``1(``0,``0)                                              | Defines the operator gtz:T = gt(a,b) ? ones[T] : zero[T]
Method      | Z0.gmath.comparer``1                                                  | Creates a parametric numeric comparer
Method      | Z0.gmath.eq``1(``0,``0)                                               | Defines the test eq:bit := a == b, succeeding if numeric equality holds between the operands
Method      | Z0.gmath.gt``1(``0,``0)                                               | Defines the test gt:bit := a &gt; b, succeeding if the left operand is larger than the right operand
Method      | Z0.gmath.gteq``1(``0,``0)                                             | Defines the test gt:bit := a &gt;= b, succeeding if the first operand is larger than or equal to the second
Method      | Z0.gmath.neq``1(``0,``0)                                              | Defines the test neq:bit := a != b, succeeding if the operands are not equal
Method      | Z0.gmath.nonz``1(``0,``0)                                             | Returns an alternate value if the nonz test succeeds for the source value
Method      | Z0.gmath.nonz``1(``0)                                                 | Defines the test nonz:bit := a != 0, succeeding if the source operand is nonzero
Method      | Z0.gmath.positive``1(``0)                                             | Defines the test t:bit = src &gt; 0
Method      | Z0.gmath.counted``1(``0)                                              | Defines a scalar sequence {0,1,...,count-1}
Method      | Z0.gmath.decrements``1(System.Int32,``0@)                             | Populates a memory target with consecutive values count-1, count - 2, ..., 0
Method      | Z0.gmath.decrements``1(``0,System.Int32,``0@)                         | Populates a memory target with consecutive values first, first - 1, ... first - (n - 1)
Method      | Z0.gmath.decrements``1(``0,System.Span{``0})                          | Populates a span with consecutive values first, first - 1, ... first - (n - 1)
Method      | Z0.gmath.increments``1(System.Span{``0})                              | Populates a span of length n with consecutive values 0,1,...n - 1
Method      | Z0.gmath.increments``1(``0,System.Int32,``0@)                         | Populates a memory target with values first, first + 1, ... first + (n - 1)
Method      | Z0.gmath.increments``1(System.Int32,``0@)                             | Populates a memory target with consecutive values 0,1,...count-1
Method      | Z0.gmath.increments``1(``0,System.Span{``0})                          | Populates a span with values first, first + 1, ... first + (n - 1)
Method      | Z0.gmath.range``1(``0)                                                | Creates the numeric sequence {0,1,...,count-1}
Method      | Z0.gmath.range``1(``0,``0)                                            | Creates a numeric sequence that ranges between inclusive upper and lower bounds
Method      | Z0.gmath.range``1(``0,``0,``0)                                        | Creates a numeric sequence that ranges between inclusive upper and lower bounds
Method      | Z0.gmath.squeeze``1(``0,``0)                                          | Evenly projects points from the interval [0,maxval[T]] onto the interval [0,max]
Method      | Z0.gmath.squeeze(System.Byte,System.Byte)                             | Evenly projects points from the interval [0,2^8 - 1] onto the interval [0,max]
Method      | Z0.gmath.squeeze(System.UInt16,System.UInt16)                         | Evenly projects points from the interval [0,2^15 - 1] onto the interval [0,max]
Method      | Z0.gmath.squeeze(System.UInt32,System.UInt32)                         | Evenly projects points from the interval [0,2^31 - 1] onto the interval [0,max]
Method      | Z0.gmath.squeeze(System.UInt64,System.UInt64)                         | Evenly projects points from the interval [0,2^63 - 1] onto the interval [0,max]
Method      | Z0.gmath.zclear``1(``0)                                               | If the source value is nonzero, it is returned unmolested; othwewise, -1 is returned
Method      | Z0.Partition.stream``1(Z0.Interval{``0},``0,System.Nullable{System.Int32})| Slices an interval into manageable pieces, disjoint even
Method      | Z0.Partition.measured``1(Z0.Interval{``0},``0)                        | Computes the points that determine a partitioning predicated on partition width
Method      | Z0.Partition.counted``1(Z0.Interval{``0},System.Int32)                | Calculates the points that determine a partitioning predicated on partition count
Method      | Z0.Partition.counted``2(Z0.Interval{``1},System.Int32)                | Partitions an interval predicated on partition count
Method      | Z0.Partition.width``1(Z0.Interval{``0},``0)                           | Partiions an invterval predicated on partition width
Method      | Z0.Partition.integral``1(Z0.Interval{``0},``0)                        | Computes the points that determine a partitioning predicated on partition width
Method      | Z0.XTend.Permute``1(System.ReadOnlySpan{``0},Z0.Perm)                 | Shuffles span content as determined by a permutation
Method      | Z0.XTend.Permute``1(System.Span{``0},Z0.Perm)                         | Shuffles span content as determined by a permutation
Method      | Z0.XTend.Swap``1(System.Span{``0},Z0.Swap[])                          | Applies a sequence of transpositions to source span elements
Method      | Z0.XTend.FormatAsPerm``1(System.Span{``0},System.Nullable{System.Int32})| Formats the terms of a permutation
Method      | Z0.XTend.FormatAsPerm``1(System.ReadOnlySpan{``0},System.Nullable{System.Int32})| Formats the terms of a permutation
Method      | Z0.XTend.Format(Z0.Swap[])                                            | Formats a sequence of successive transpositions (a chain)
Method      | Z0.XTend.Contains``1(Z0.Interval{``0},``0)                            | Determines whether an interval contains a specified point
Method      | Z0.XTend.Contains``1(System.ReadOnlySpan{``0},``0)                    | Determines whether any elements of the source match the target
Method      | Z0.XTend.Identical``1(System.Span{``0},System.Span{``0})              | Returns 1 if the left and right spans contain identical content and 0 otherwise
Method      | Z0.XTend.Identical``1(System.ReadOnlySpan{``0},System.ReadOnlySpan{``0})| Returns 1 if the left and right spans contain identical content and 0 otherwise
Method      | Z0.XTend.WithEndpoints``2(``0,``1,``1)                                | Creates the same kind of interval with alternate endpoints
Type        | Z0.DivisorIndex`1                                                     | Associates a contiguous sequence of dividends with their divisor lists
Type        | Z0.DivisorList`1                                                      | Encapsulates a divisor along with its dividends
Property    | Z0.DivisorList`1.Dividend                                             | The dividend
Property    | Z0.DivisorList`1.Divisors                                             | The values that divide the dividend
Method      | Z0.Divisors.DefineList``1(``0,``0[])                                  | Constructs a divisor list
Method      | Z0.Divisors`1.index(Z0.Interval{`0})                                  | Computes the divisors for each number in a specified interval
Method      | Z0.Divisors`1.indices(Z0.Interval{`0},`0)                             | Computes a divisor index stream
Method      | Z0.IntervalOps.Length``1(Z0.Interval{``0})                            | Computes the length of the interval by finding the magnituded of the difference             between its left/right endpoints
Method      | Z0.nonzero.create``1(``0)                                             | Manufactures a numeric proxy defined over the punctured domain T / {0}. If a            zero value is supplied, it is replaced with -1
Type        | Z0.NatPerm`1                                                          | Defines a permutation of natural length N over the natural numbers 0,1,...,N-1
Property    | Z0.NatPerm`1.Identity                                                 | The canonical identity permutation of length N
Property    | Z0.NatPerm`1.Empty                                                    | The empty permutation of length N
Method      | Z0.NatPerm`1.Alloc                                                    | Allocates an empty permutation
Method      | Z0.NatPerm`1.op_Implicit(Z0.NatPerm{`0})~Z0.Perm                      | Implicitly converts the source to an unsized permutation
Method      | Z0.NatPerm`1.op_Multiply(Z0.NatPerm{`0},Z0.NatPerm{`0})               | Computes the composition h of f and g where h(i) = g(f(i)) for i = 0, ... n
Method      | Z0.NatPerm`1.op_OnesComplement(Z0.NatPerm{`0})                        | Computes the inverse of f
Method      | Z0.NatPerm`1.#ctor(Z0.NatSwap{`0}[])                                  | Initializes a permutation with the identity followed by a sequence of transpostions
Method      | Z0.NatPerm`1.#ctor(System.Int32[])                                    | Initializes a permutation with array content that implicitly defines a permutation
Property    | Z0.NatPerm`1.Item(System.Int32)                                       | Term evaluator/manipulator where
Property    | Z0.NatPerm`1.Length                                                   | The permutation length
Method      | Z0.NatPerm`1.Swap(Z0.NatSwap{`0}@)                                    | Effects a transposition (i,j) -&gt; (j, i)
Method      | Z0.NatPerm`1.Swap(System.Int32,System.Int32)                          | Effects a transposition (i,j) -&gt; (j, i)
Method      | Z0.NatPerm`1.Swap(System.ValueTuple{System.Int32,System.Int32}[])     | Effects a sequence of transpositions
Method      | Z0.NatPerm`1.Swap(Z0.NatSwap{`0}[])                                   | Effects a sequence of transpositions
Method      | Z0.NatPerm`1.Replicate                                                | Clones the permutation
Method      | Z0.NatPerm`1.Replicate(Z0.NatSwap{`0}@)                               | Clones the permutation and applies the transposition (i,j)
Method      | Z0.NatPerm`1.Reverse                                                  | Reverses the permutation in-place
Method      | Z0.NatPerm`1.Invert                                                   | Computes the inverse permutation t of the current permutation p             such that p*t = t*p = I where I denotes the identity permutation
Method      | Z0.NatPerm`1.Compose(Z0.NatPerm{`0})                                  | Creates a new permutation p via composition, p[i] = g(f(i)) for i = 0, ... n            where f denotes the current permutation
Method      | Z0.NatPerm`1.Inc                                                      | Applies a modular increment to the permutation in-place
Method      | Z0.NatPerm`1.Dec                                                      | Applies a modular decrement to the permutation in-place
Method      | Z0.NatPerm`1.Cycle(System.Int32)                                      | Computes a permutation cycle originating at a specified point
Method      | Z0.NatPerm`1.Format(System.Nullable{System.Int32})                    | Formats a permutation as a 2-column matrix
Type        | Z0.NatPerm`2                                                          | Defines a permutation of natural length N over the natural numbers 0,1,...,N-1
Property    | Z0.NatPerm`2.Identity                                                 | The canonical identity permutation of length N
Property    | Z0.NatPerm`2.Empty                                                    | The empty permutation of length N
Method      | Z0.NatPerm`2.Alloc                                                    | Allocates an empty permutation
Method      | Z0.NatPerm`2.op_Implicit(Z0.NatPerm{`0,`1})~Z0.Perm{`1}               | Implicitly converts the source to an unsized permutation
Method      | Z0.NatPerm`2.op_Multiply(Z0.NatPerm{`0,`1},Z0.NatPerm{`0,`1})         | Computes the composition h of f and g where h(i) = g(f(i)) for i = 0, ... n
Method      | Z0.NatPerm`2.op_OnesComplement(Z0.NatPerm{`0,`1})                     | Computes the inverse of f
Method      | Z0.NatPerm`2.#ctor(Z0.NatSwap{`0,`1}[])                               | Initializes a permutation with the identity followed by a sequence of transpostions
Method      | Z0.NatPerm`2.#ctor(`1[])                                              | Initializes a permutation with array content that implicitly defines a permutation
Property    | Z0.NatPerm`2.Item(System.Int32)                                       | Term evaluator/manipulator
Property    | Z0.NatPerm`2.Item(`1)                                                 | Term evaluator/manipulator
Property    | Z0.NatPerm`2.Length                                                   | The permutation length
Method      | Z0.NatPerm`2.Swap(Z0.NatSwap{`0}@)                                    | Effects a transposition (i,j) -&gt; (j, i)
Method      | Z0.NatPerm`2.Swap(System.Int32,System.Int32)                          | Effects a transposition (i,j) -&gt; (j, i)
Method      | Z0.NatPerm`2.Swap(System.ValueTuple{System.Int32,System.Int32}[])     | Effects a sequence of transpositions
Method      | Z0.NatPerm`2.Swap(Z0.NatSwap{`0}[])                                   | Effects a sequence of transpositions
Method      | Z0.NatPerm`2.Swap(Z0.NatSwap{`0,`1}[])                                | Effects a sequence of transpositions
Method      | Z0.NatPerm`2.Replicate                                                | Clones the permutation
Method      | Z0.NatPerm`2.Replicate(Z0.NatSwap{`0}@)                               | Clones the permutation and applies the transposition (i,j)
Method      | Z0.NatPerm`2.Reverse                                                  | Reverses the permutation in-place
Method      | Z0.NatPerm`2.Invert                                                   | Computes the inverse permutation t of the current permutation p             such that p*t = t*p = I where I denotes the identity permutation
Method      | Z0.NatPerm`2.Compose(Z0.NatPerm{`0,`1})                               | Creates a new permutation p via composition, p[i] = g(f(i)) for i = 0, ... n            where f denotes the current permutation
Method      | Z0.NatPerm`2.Inc                                                      | Applies a modular increment to the permutation in-place
Method      | Z0.NatPerm`2.Dec                                                      | Applies a modular decrement to the permutation in-place
Method      | Z0.NatPerm`2.Cycle(System.Int32)                                      | Computes a permutation cycle originating at a specified point
Method      | Z0.NatPerm`2.Cycle(`1)                                                | Computes a permutation cycle originating at a specified point
Method      | Z0.NatPerm`2.Format(System.Nullable{System.Int32})                    | Formats a permutation as a 2-column matrix
Type        | Z0.NatSwap`1                                                          | Defines a transposition in the context of a permutation of natural length
Field       | Z0.NatSwap`1.i                                                        | The first index
Field       | Z0.NatSwap`1.j                                                        | The second index
Property    | Z0.NatSwap`1.Empty                                                    | The empty element
Property    | Z0.NatSwap`1.Zero                                                     | The monodial zero
Method      | Z0.NatSwap`1.Chain(Z0.NatSwap{`0},System.Int32)                       | Creates a chain of transpositions, that includes the initial transposition
Method      | Z0.NatSwap`1.Parse(System.String)                                     | Parses a transposition in canonical form (i j), if possible; otherwise            returns the empty transposition
Method      | Z0.NatSwap`1.Format                                                   | Renders the tranposition as text in canonical form
Method      | Z0.NatSwap`1.Equals(Z0.NatSwap{`0})                                   | Determines whether this transposition is identical to another.            Note that the order of indices is immaterial
Method      | Z0.NatSwap`1.Replicate                                                | Creates a copy
Type        | Z0.NatSwap`2                                                          | Defines a transposition in the context of a permutation of natural length
Field       | Z0.NatSwap`2.i                                                        | The first index
Field       | Z0.NatSwap`2.j                                                        | The second index
Field       | Z0.NatSwap`2.Zero                                                     | The monodial zero
Method      | Z0.NatSwap`2.Chain(Z0.NatSwap{`0,`1},System.Int32)                    | Creates a chain of transpositions, that includes the initial transposition
Method      | Z0.NatSwap`2.Parse(System.String)                                     | Parses a transposition in canonical form (i j), if possible; otherwise            returns the empty transposition
Method      | Z0.NatSwap`2.FromTuple(System.ValueTuple{`1,`1})                      | Converts a tuple representation to a swap
Method      | Z0.NatSwap`2.op_Implicit(Z0.NatSwap{`0,`1})~Z0.Swap{`1}               | Implicitly converts the transpostion to its unsized representation
Method      | Z0.NatSwap`2.op_Implicit(Z0.NatSwap{`0,`1})~System.ValueTuple{`1,`1}  | Implicitly converts the transpostion to its canonical tuple representation
Method      | Z0.NatSwap`2.Format                                                   | Renders the tranposition as text in canonical form
Method      | Z0.NatSwap`2.Equals(Z0.NatSwap{`0,`1})                                | Determines whether this transposition is identical to another.            Note that the order of indices is immaterial
Method      | Z0.NatSwap`2.ToTuple                                                  | Converts the transpostion to its canonical tuple representation
Method      | Z0.NatSwap`2.Replicate                                                | Creates a copy
Type        | Z0.Perm                                                               | Defines a permutation over the integers [0, 1, ..., n - 1] where n is the permutation length
Field       | Z0.Perm.terms                                                         | Defines the permutation (0 -&gt; terms[0], 1 -&gt; terms[1], ..., n - 1 -&gt; terms[n-1])            where n is the length of the array
Method      | Z0.Perm.Build``1(``0,System.ValueTuple{``0,``0}[])                    | Creates a generic permutation by application of a sequence of transpositions to the identity permutation
Method      | Z0.Perm.Build``1(``0,Z0.Swap{``0}[])                                  | Creates a generic permutation by application of a sequence of transpositions to the identity permutation
Method      | Z0.Perm.Alloc(System.Int32)                                           | Allocates an empty permutation
Method      | Z0.Perm.Alloc``1(System.Int32)                                        | Allocates an empty permutation of specified length
Method      | Z0.Perm.Identity(System.Int32)                                        | Defines an untyped identity permutation
Method      | Z0.Perm.identity``1(``0)                                              | Defines an identity permutation on n symbols
Method      | Z0.Perm.Init(System.ReadOnlySpan{System.Int32})                       | Defines an untyped permutation determined by values in a source span
